{
  "format": 2,
  "artDirection": { "family": "store" },
  "style": "continuous",
  "out": "out",
  "icons": "material",
  "gutter": 0,
  "sizes": ["play-phone", "ios-69"],
  "frames": [
    { "id": "01-home", "screen": "home", "head": "REPLACE: the promise, <em>in six words</em>", "sub": "REPLACE: one line that backs it up" },
    { "id": "02-activity", "screen": "activity", "head": "REPLACE: the differentiator", "sub": "REPLACE: what it gives the user" },
    { "id": "03-home-tilt", "screen": "home", "head": "REPLACE: the core action", "sub": "REPLACE: how it feels",
      "device": { "x": 0.58, "rotate": 6, "scale": 0.92 } },
    { "id": "04-activity-bottom", "screen": "activity", "head": "REPLACE: the resolution", "sub": "REPLACE: the outcome",
      "caption": { "pos": "bottom" } },
    { "id": "05-brand", "screen": null, "platforms": ["android"] }
  ],
  "objects": [
    { "type": "ribbon", "points": [[-0.2, 0.86], [0.6, 0.92], [1.2, 0.58], [2.1, 0.3], [3.0, 0.66], [3.8, 0.5], [4.6, 0.2], [5.2, 0.3]], "w": 0.14, "colors": ["accent", "ink"], "texture": "none" },
    { "type": "shape", "shape": "blob", "x": 1.0, "y": 0.34, "w": 0.22, "color": "accent", "z": "back", "opacity": 0.5 },
    { "type": "phone", "screen": "activity", "x": 1.97, "y": 0.62, "w": 0.46, "rotate": -10, "z": "back" },
    { "type": "toast", "x": 0.5, "y": 0.74, "w": 0.66, "title": "REPLACE: a real notification title", "body": "REPLACE: its real body text", "icon": "notifications|notifications" },
    { "type": "card", "x": 3.5, "y": 0.2, "w": 0.52, "label": "REPLACE: a label", "value": "REPLACE", "tone": "accent" },
    { "type": "brand", "x": 4.5, "y": 0.46, "w": 0.8, "text": "REPLACE: app name", "size": 2.2 },
    { "type": "text", "x": 4.5, "y": 0.56, "w": 0.7, "text": "REPLACE: three pillars", "size": 0.9, "font": "text", "color": "inkMuted" }
  ]
}
